#REF!,Spell Name,Level,School,Ritual,Casting Time,Range,V Verbal,S Posture,M Materials,Material Content,Duration,Spell Description,Name,English
Name,Bard,Cleric,Druid,Paladin,Ranger,Warlock,Wizard,Mage,Artificer,Time Mage,Gravity Mage,Source #REF!,Acid Splash,0,Conjuration,x,1 Action,60 ft.,V,S,×,×,Instant,"· You throw a
ball of acid. Designate
a creature within range, or designate two creatures within range that are no more than 5 feet apart. Each target must make a Dexterity saving throw or take 1d6 points of acid damage on
a failed save. · At 5th level, the damage of this spell increases by 1d6 (to 2d6), at 11th level by another 1d6 (to 3d6), and at 17th level by another 1d6 (to 4d6).",Acid Splash,Acid
Splash,,,,,√,,√,√,,,Player's Handbook #REF!,Blade
Ward,0,Warranty,x,1 Action,Self,V,S,×,×,1 Round,· You reach out and trace a mark of war in the air, granting you resistance to bludgeoning, piercing, and slashing damage from
weapon attacks until the end of your next turn. ,Blade Ward,√,,,,√,√,√,,,Player's Handbook #REF!,Thunder Sword,0,Evocation,x,1 Action,Self
(5-foot radius),×,S,M,A melee weapon worth at least 1 sp,1 round,"· As part of casting this spell, you must make a melee attack with your weapon against a creature within 5 feet. If the
attack hits, the target is affected by the normal effects of the attack and is enveloped in a burst of energy until the start of your next turn. If the target voluntarily moves 5 feet or
more before the spell ends, it immediately takes 1d8 points of thunder
damage and the spell ends. · The damage of this spell increases as you level. At 5th level, this melee attack deals an additional 1d8 points of thunder damage, and the target takes 2d8
points of damage if it moves. Both damage dice increase by 1d8 (2d8 and 3d8) at 11th level, and 1d8 (2d8 and 3d8) at 17th level. Add 1d8 at 5th level (3d8 and 4d8). ",Booming
Blade,,,,,√,√,√,√,,,,Sword Coast Adventurer's Guide#REF!,Frigid Touch,0,Undead,x,1 Action,120 ft.,V,S,×,×,1 Round,"· You summon a ghostly bone hand to the location of a creature
within range, which strikes the target with the biting chill of the grave. You make a ranged spell attack against that creature. On a hit, the hand grabs the target
and causes it to take 1d8 necrotic damage and not regain hit points until the start of your next turn. · If the target of your attack is an undead, it has disadvantage on attack rolls against
you until the end of your next turn. · At 5th level, the damage of this spell increases by 1d8 (to 2d8). At 11th level, add another 1d8 (to 3d8), 17th level, add another 1d8 (to 3d8),
18th level, add another 1d8 (to 3d8), 20th level, add another 1d8 (to 3d8), 30th level, add another 1d8 (to 3d8), 40th level, add another 1d8 (to 3d8), 50th level, add another 1d8 (to 3d8),
60th level,
add another 1d8 (to 3d8), 70th level, add another 1d8 (to 3d8), 80th level, add another 1d8 (to 3d8), 90th level, add another 1d8 (to 3d8), 100th level, add another 1d8 At level 1, add 1d8
(to 4d8). ",Chill Touch,,,,,,√,√,√,,,,Player's Handbook #REF!,Control Fire,0,Variation,x,1 Action,60 ft.,×,S,×,×,Instant or 1 Hour,"· You choose a nonmagical fire you can see within range
that occupies a 5-foot cube. You affect this fire in one of the following ways: · You immediately cause the fire to spread 5 feet in one direction, as if there were
wood or other fuel in the new location. · You immediately extinguish the fire in that space. · You double or halve the size of the bright and dim areas created by the fire, and/or change
their color. This change lasts for 1 hour. · You cause the fire to produce a simple image—such as a vague image of a creature, a fixed object, or a location—that appears in the flame and
changes as you wish. This image lasts for 1 hour. · If you cast this spell multiple times, you can cause up to 3 ",Control
Flames,,,√,,√,,√,,,,Xanatha's Guide to Everything #REF!,Create Bonfire,0,Conjuration,x,1 Action,60 ft.,V,S,×,×,"Concentration,Up to 1 min.","· You light a bonfire on the ground within a range
that you can see. Until the spell ends, this magical bonfire fills a 5-foot cubic space. When you cast this
spell, each creature in the bonfire's space must succeed on a Dexterity saving throw or take 1d8 points of damage. A creature must also make this
saving throw when it enters the bonfire's space for the
first time in a turn or when it ends its turn in the bonfire's space. · The bonfire can ignite flammable objects in the area that are not being worn or carried. · At 5th level, the damage of
this spell increases by 1d8 (to 2d8). At 11th level, add 1d8 (to 3d8), and at 17th level, add 1d8 (to 4d8). ",Create Bonfire,,,√,,√,√,√,√,,,Xanatha's Guide to Everything #REF!,Dancing
Lights,0,Evocation,x,1 Action,120 ft.,V,S,M,A bit of phosphorus or glow elm, or a firefly,"Concentration,Up to 1 minute","· You
create four torch-sized sources of light within range. For the duration of the spell, the sources appear as torches, lanterns, or orbs of light that float in midair. You can also combine the
four sources into a single, indistinct shadow of a Medium humanoid. Whichever method you choose, each source casts dim light in a 10-foot
radius.
· You can use a bonus action on your turn to move these lights up to 60 feet within range. Each light must be within 20 feet
of the other, and lights that leave range are immediately extinguished. ",Dancing Lights,√,,,,√,, √,√,,,Player's Handbook
#REF!,Druid
Tricks,0,Variation,x,1 Action,30 Feet,V,S,×,×,Instant,"· You whisper to the spirits of nature, creating one of the following
effects:
√ You create a small, harmless sensory effect that predicts the weather conditions in your location for the next 24 hours. The
effect can manifest as a golden ball for a clear sky, a cloud for a rainy day, snowflakes for a snowy day, and so on. This
effect lasts for 1 round. √ You can instantly cause a flower to bloom, a seed to
break its shell, or a leaf to sprout. √You create a small, harmless, immediate sensory effect, such as falling leaves, a breeze,
the movement of a small animal, or the faint
scent of a skunk. This effect operates only in a 5-foot cube. √You can instantly light or extinguish a candle, a torch,
or a small campfire.",Druid
Tricks,Druidcraft,,, √,,,,,,,,,Player's Handbook#REF!,Magic Burst,0,Evocation,x,1 Action,120 ft.,V,S,×,×,Instant,"·A beam of
intense energy shoots out at a creature within range. Make a ranged spell attack against that
target, and if it hits, the target takes 1d10 points of force damage. ·As you reach higher levels, the spell can create more
rays at once: two at 5th level, three at 11th level, and four at 17th level. You can decide whether these rays strike the
same target or separate targets, and make separate attack rolls for
each ray. ",Eldritch Blast,Eldritch Blast,,,,,,,√,,,,,Player's Handbook#REF!,Fire Arrow,0,Evocation,x,1 Action,120
ft.,V,S,×,×,Instant,"· You hurl a handful of flame at a creature or object within range, making a ranged spell attack against the
target. If the target hits, the target takes
1d10 points of fire damage. Combustible objects not worn or carried will ignite when hit by this spell. · When you reach 5th
level, the damage of this spell increases by 1d10 (to 2d10). At 11th level, add another 1d10 (to
3d10), and at 17th level, add another 1d10 (to 4d10). ",Fire Bolt,,,,,√,,√,√,,,Player's Handbook #REF!,Friend,0,Enchant,x,1
Action,Self,×,S,M,Some cosmetics applied to the face when the spell is cast,"Concentration,Up to 1 minute",· Designate
a nonhostile creature that you have advantage on all Charisma checks against it for the duration of the spell. When the
spell ends, the creature realizes that you have used magic to manipulate its emotions, and becomes hostile toward you. A
violent creature may attack you directly, while a nonviolent creature may seek some other form of revenge (as determined
by
the DM), depending on the specific context of your interaction with it.,Friend,√,,,,√,√,√,,,,Player's Handbook
#REF!,Frostbite,0,Evocation,x,1 Action,60 ft.,V,S,×,×,Instantly,"· You cause a creature you can see within range to freeze.
The target must make a Constitution saving throw. On a failed
save, the target takes 1d6 points of cold damage and gains disadvantage on the next weapon attack roll made before the
end of its next turn. · When you reach 5th level, the damage of this spell increases by 1d6 (to 2d6).
At 11th level, add another 1d6 (to 3d6), and at 17th level, add another 1d6 (to 4d6). ",Frostbite,,,√,,,√,√,√,√,,,Xanatha's Guide
to Everything#REF!,Emerald Blade,0,Evocation,x,1 Action,Self (5-foot radius),×,S,M,A melee weapon worth at least 1
sp,Instant,"· As part of casting this spell, you must make a melee attack with your weapon against a creature within 5
feet. If the attack hits, the target is affected by the attack normally, and the
emerald flame jumps from the target to another creature within 5 feet of it. The second creature takes points of fire
damage equal to your spellcasting ability modifier. The damage of this spell increases as you level. At 5th level, this melee
attack deals an extra 1d8 fire damage, and the second target takes 1d8 + your spellcasting ability modifier. Both damage
dice increase by 1d8 at 11th
level (2d8 and 2d8), and by another 1d8 at 17th level (3d8 and 3d8). ",Green Flame Blade,,,,,√,√, √,√,,,Sword Coast
Adventurer's Guide#REF!,Guidance,0,Divination,x,1 Action,Reach,V,S,×,×,"Concentration,Up to 1 minute",· You touch a
willing creature. Before the spell ends, the target can choose to roll an additional d4 on an ability check and add the result
to the check. It can roll before or after making the ability check. The spell then ends.,Guidance,,√,√,,,,,√,,,Player's Handbook

#REF!,Dancing Wind,0,Variation,x,1 Action,30 ft.,V,S,×,×,Instant,"· At a point within range that you can see, the air is controlled
by you, forcing one of the following effects: ·
A Medium or smaller creature of your choice must succeed on a Strength saving throw or be pushed 5
feet away. · You can create a small burst of air, enough to move an object that is not being held or carried and weighs no
more than 5 pounds. The object is pushed 10 feet away
from you. The force created this way is not enough to cause damage. · You manipulate the air to create harmless sensory
sensations, such as rustling leaves, closing shutters, or your clothing
fluttering in the breeze.",Dancing Wind,Gust,,,√,,,√,,√,,,,Xanatha's Guide to Everything#REF!,Insect Swarm,0,Conjuration,x,1
Action,30 feet,V,S,M,One living flea,Instant,"· You cause a creature within range that you can see to temporarily swarm with
mites, fleas, and other parasites. The target must succeed on a Constitution saving throw or take 1d6 points of poison damage
and move 5 feet in a random direction, as long as it can move and has a speed of at least 5 feet. Roll 1d4 to determine
direction: 1, north; 2, south;
3, east; 4, west. This movement does not provide attacks of opportunity, and if movement in that direction is blocked, the
target does not move. · The damage of this spell increases by 1d6 points
at 5th level (2d6), 11th level (3d6), and 17th level (4d6).",Infestation,,,√,,,√,√,√,,,,Xanatha's Guide to
Everything#REF!,Light,0,Evocation,x,1 Action,Reach,V,×,M,One firefly or a patch of phosphorescent moss,1 hours,"· You
touch an object no larger than 10 feet in any direction. Until the spell ends, the object shines brightly in a 20-foot radius and
dimly in an additional 20 feet. The color of the light is yours, and the object's light is blocked if it is completely
obscured by something opaque. The spell ends if you cast it again or use an action to dismiss it. · If you target an object held
or worn by a hostile creature, that creature must make a Dexterity saving throw to try to
shake off the spell's effects.",Light,√,√,,,√,,√,√,,,Player's Handbook#REF!,Lightning Pull,0,Evocation,x,1 Action,15
feet,V,×,×,×,Instant,"· You create a whip of lightning energy that strikes a creature you can see within 15 feet. The target must
make a Strength saving throw or be pulled 10 feet closer to you in a
straight line. ft. If the target is within 5 feet of you after you pull in, it takes 1d8 points of lightning damage. · When you reach
5th level, the damage of this spell increases by 1d8 (to 2d8). At 11th level, add another 1d8 (to 3d8), and at
17th level, add another 1d8 (to 4d8). ",Lightning Lure,,,,,,√,√,√,√,,,Sword Coast Adventurer's Guide#REF!,Mage's
Hand,0,Conjuration,x,1 Action,30 Feet,V,S,×,×,1 Minute,"· A floating ghostly hand appears at a point you specify within range.
The ghostly hand persists until the spell ends or until you dismiss the spell as an action. If the
ghostly hand is more than 30 feet away from you or if you cast the spell again, the existing ghostly hand disappears. · You
can use your actions to control the ghost hand, and use it to perform one action: you can manipulate an object, open an
unlocked door or container, place an object in or take an
object out of a container, or pour the contents of a vial. You can move the ghost hand up to 30 feet each time you use it.
· The ghost hand can't attack, or activate
magic items or carry more than 10 pounds of matter. ",Mage Hand,Mage Hand, √,,,,√,√,√,√,,,Player's Handbook #REF!,Magic
Stone,0,Variations,x,1 Bonus Action,Touch,V,S,×,×,1 Minute,"· You touch one to three small stones, infusing them with
magical power. You or another person can make a ranged spell attack by throwing one of the small stones, either unarmed or
with a sling. If thrown unarmed, its range is 60 feet. If someone other than you attacks with a small rock, the attacker adds
your spellcasting ability modifier to his or her attack roll, not the
attacker's. If the target hits, the target takes 1d6 points of bludgeoning damage equal to your spellcasting ability
modifier. Whether the target hits or not, the magic on the rock is lost.
If you cast this spell again, the effect of the spell on the affected rock ends earlier than it did when it was cast previously.
",Magic Stone,,,√,,,√,,√,,,,Sannasa's Guide to Everything #REF!,Mending,0,Variation,x,1 Minute,Touch,V,S,M,Two
Lodestones,Instant,"·This spell repairs a tear or crack in an object you touch, such as a broken chain, a key that's broken
in two, a torn cloak, a leaking wineskin, and so on. As long as the tear or crack is no more than 1 foot in any direction, you
can repair it without leaving a trace. ·This spell physically repairs a magic item or construct but does not restore the magic of such an item. ",Mending,
#REF!,Message,0,Alteration,x,1 Action,120 ft.,V,S,M,Small piece of copper wire,1 round,"· You point your finger at a creature
within range and whisper a message. The target (and only the target) hears the message and can reply in a whisper that
only you
can hear. · You can cast this spell through solid objects, but you must be familiar with the target and know it is behind the
barrier. Magical silence, 1 foot of stone, 1 inch of common metal, a thin sheet of lead, or 3 feet of wood can block the spell.
The spell does not need to travel in a straight line; it can pass around corners and through
holes.",Message,Message,√,,,,√,,√,√,,,Player's Handbook#REF!,Mind Wedge,0,Enchantment,x,1 Action,60 ft.,V,×,×,×,1
Round,"· You pierce the mind of a visible creature within range with a spike of psionics. The target must make an
Intelligence saving throw or take 1d6 points of psychic damage, and on
your next saving throw before the end of your turn, subtract 1d4 from the result. · The damage of this spell increases by
1d6 at certain levels: 5th level (2d6), 11th level (3d6), 17th level (4d6).",Mind
Sliver,,,,,,√,√,√,,,Tasha's Cauldron#REF!,Minor Illusion,0,Illusion,x,1 Action,30 ft.,×,S,M,A small piece of wool,1 minute,"· You
create an image of a sound or object within range that lasts until the spell's duration ends. You can also use an action to
dismiss the illusion or cast
the spell again to end it. If you create a sound, it can be as loud as a whisper or a high scream. It can be your voice or
anyone else's, or it can be the roar of a lion, the sound of a drum, or any other sound you specify. The sound does not
diminish over its duration, or you can create several discrete sounds at different
times before the spell ends. If you create an image of an object (such as a chair, a footprint in the mud, a small box), the
object must be no larger than a 5-foot cube. The image has no sound, light, smell, or any other sensory effect. Since
images can be penetrated by any object, physical interaction with them reveals their true
nature as illusions. A creature that uses its action to investigate the sound or image must make an Intelligence (Investigation)
check against the spell's save DC to determine that it is an illusion. Illusions appear blurry to creatures that see
through them. ",Minor Illusion,Minor
Illusion,√,,,,√,√,√,,,Player's Handbook #REF!,Shaping Earth,0,Transformation,x,1 Action,30 ft.,×,S,×,×,Instant or 1 Hour,"·
You choose a pile of dirt or a piece of rock that you can see within range and that fills a 5-foot cube.
You can transform it in one of the following ways: · If you point to a patch of loose soil, you can immediately dig it up,
causing it to move along the surface and be
transported up to 5 feet away. The force of this movement is not enough to cause damage. · You cause the dirt or rock to
change
shape and/or color, to write words, draw patterns, or carve patterns. This transformation lasts for 1 hour. · If the dirt or
rock you specify is on the surface, you can cause it to become difficult terrain.
Alternatively, you can cause an area of the surface that is already difficult terrain to become normal terrain. This
transformation lasts for 1 hour. · If you cast this spell multiple times, you can have up to
two non-immediate effects active at the same time, and you can dismiss any of these effects as an action. ",Mold
Earth,,,√,,,√,,√,,,,Xanatha's Guide to Everything#REF!,Poison Spray,0,Conjuration,x,1 Action,10
ft.,V,S,×,×,Instant,"· You extend your hand and spray a stream of poisonous gas at a creature you can see within range.
The target must make a Constitution saving throw or take 1d12 poison damage on a failed save. · At 5th
level, the damage of this spell increases by 1d12 (to 2d12). At 11th level, add 1d12 (to 3d12), and at 17th level, add 1d12
(to 4d12)",Poison Spray,,,√,,√,√,√,√,√,,,Player's Handbook #REF!,Magic
Trick,0,Variation,x,1 Action,10 ft.,V,S,×,×,Up to 1 hour,"·This spell is a small magical trick for novice spellcasters to
practice. You create one of the following magical effects within range:
√You create an immediate, harmless sensory effect, such as a spark,
a gust of wind, faint music, or a strange odor. √You instantly light or extinguish a candle, a torch, or a small campfire.
√You instantly make an object no larger than 1 cubic foot clean or dirty. √You instantly cool, warm, or flavor an inanimate
object no larger than 1 cubic foot, with the effect lasting 1 hour. √ You create a patch of color, a mark, or a symbol on an object or surface that lasts 
· If you cast this spell multiple times, you can maintain up to three different non-instantaneous effects at the same time,
and you can dismiss one of them with an action.",Prestidigitation,√,,,,√,√,√,√,,,Player's Handbook
#REF!,Primal Brute,0,Variation,x,1 Action,Self,×,S,×,×,Instant,"· Your teeth or nails grow long and sharp, ready to deliver
an acidic blow. Make a melee spell attack against a creature within 5 feet of you. On a hit, the target takes 1d10 points of
acid damage. After you make this attack, your teeth or nails return to normal. · The
damage of this spell increases by 1d10 points at 5th level (2d10), 11th level (3d10), and 17th level (4d10). ",Primal
Savagery,,,√,,,,,,,,,Sannasa's Guide to Everything#REF!,Fire,0,Conjuration,x,1
Action,Self,V,S,×,×,10 minutes,"·A flickering flame appears in your hand. The flame lasts for the spell's duration and cannot
harm you or your equipment. The flame provides bright light in a 10-foot radius around it, and dim light up to 10 feet
beyond that radius. The spell ends when you cast it again or dispel it as an action. ·Alternatively, you can attack with
the fire, which ends the spell. When you cast this spell, you can hurl the flame at a creature within 30 feet of you and
make a ranged spell attack against it that deals 1d8 points of fire damage. You can also do this as an action in a subsequent
turn after casting the spell. · When you reach 5th level, the
damage of this spell increases by 1d8 (to 2d8). At 11th level, add another 1d8 (to 3d8), and at 17th level, add another 1d8
(to 4d8). ",Produce Flame,,,√,,,,,,,,,Player's Handbook#REF!,Freezing
Ray,0,Evocation,x,1 Action,60 ft.,V,S,×,×,Instant,"· A beam of icy bluish-white light shoots out at a creature within range.
You make a ranged spell attack against the target. If you hit, the target takes 1d8 points of freezing damage and its speed
is reduced by 10 feet until the start of your
next turn. · When you reach 5th level, the damage of this spell increases by 1d8 (to 2d8). At 11th level, add another 1d8 (to
3d8), and at 17th level, add another 1d8 (to 4d8). ",Ray of Frost,,,,,√,,√,√,,,Player's Handbook
#REF!,Increase Resistance,0,Protection,x,1 Action,Reach,V,S,M,A tiny cloak,"Concentration,Up to 1 minute",· You touch a
willing creature. Before the spell ends, the target can choose to roll an additional d4 on a saving throw and add the result to
the roll. It can roll before or after making the saving throw. The spell then ends.,Increase Resistance,Resistance,,√,
√,,,,,√,,,Player's Handbook
#REF!,Holy Fire,0,Evocation,x,1 Action,60 ft.,V,S,×,×,Instantly,"· A flaming glow cascades down on a creature you can see
within range. The target must make a Dexterity saving throw or take 1d8 radiant damage on a failed save. The target does
not gain the benefit of cover on this saving
throw. · When you reach 5th level, the damage of this spell increases by 1d8 (to 2d8). At 11th level, add another 1d8 (to
3d8), and at 17th level, add another 1d8 (to 4d8). ",Sacred Flame,,√,,,,,,,,,,Player's
Handbook#REF!,Weakening Thorn,0,Necromancer,x,1 Action,30 ft.,V,S,×,×,Instant,"· You weaken the vitality of a creature
you can see within range. The target must succeed on a Constitution saving throw or take 1d4 points of
necrotic damage and fall prone. · The spell's damage increases by 1d4 at 5th level (2d4), 11th level (3d4), and
17th level (4d4). ",Sapping Sting,,,,,,,,,,√,√,Sapping Sting Explorer's
Guide#REF!,Water Manipulation,0,Alteration,x,1 Action,30 ft.,×,S,×,×,Instant or 1 hour,"· You select a 5-foot cube of water
that you can see within a range. You can manipulate it in one of the following
ways: · You immediately cause or alter the flow of the water in a direction of your choice, up to 5 feet in any direction. The
force of this
movement is insufficient to cause damage. · You cause the water to take on simple shapes
and move as you wish. This change lasts for 1 hour. · You change the color or clarity of the water. The
water must be altered in its entirety. This change lasts for 1 hour. · You
freeze the water, as long as no living creatures are within it. The water thaws in 1 hour. If you cast this spell more than
once, you can have up to two non-immediate effects active at the same time, and you can
dismiss any of them as an action. ",Shape Water,,,√,,√,,√,,,,Shanasa's Guide to Everything#REF!,Shillelagh,0,Variation,x,1
Bonus Action,Reach,V,S,M,Some mistletoe, a clover leaf, and a short club or staff,1 minute,· You imbue a short club or staff
held in your hand with the power of nature. When you make melee attacks with this weapon for the duration of the spell,
you use your spellcasting key attribute instead of Strength for attack rolls and damage rolls, and the weapon's damage dice
become d8s. In addition, if the weapon was not already magic, it becomes so. The spell ends when you cast this spell again or discard it.,Shillelagh,,,
#REF!,Shocking Grasp,0,Evocation,x,1 Action,Reach,V,S,×,×,Instant,"· Lightning flashes from your hands, shocking a creature
you touch. Make a melee spell attack against the target. If the target is wearing metal armor, you have advantage on this
check. On a hit, the target takes 1d8 points of lightning damage and can't perform any reactions until the
start of its next turn. · At 5th level, this spell deals 1d8 more damage (to 2d8). At 11th level, add another 1d8 (to 3d8), and at
17th level, add another 1d8 (to 4d8).",Shocking Grasp,,,,,,√,,√,,,Player's
Handbook#REF!,Sustain,0,Undead,x,1 Action,Reach,V,S,×,×,Instant,· You touch a living creature with 0 hit points, instantly
stabilizing it. This spell has no effect on undead and constructs.,Sustain,Spare the Dying,, √,,,,,,,√,,,Player's
Handbook#REF!,Blade
Burst,0,Conjuration,x,1 Action,Self (5-foot radius),V,×,×,×,Instant,"· You instantly create a circle of translucent blades that
sweep around you. Each creature except you in the spell's area must succeed on a Dexterity saving throw or take 1d6
points of force damage. ·
At 5th level, this spell deals 1d6 more damage (to 2d6). At 11th level, add another 1d6 (to 3d6), and at 17th level, add
another 1d6 (to 4d6).",Blade Burst,,,,,√,√,√,√,,,,Sword Coast Adventurer's
