#REF!,Spell Name,Level,School,Ritual,Casting Time,Range,V Verbal,S Posture,M Materials,Material Content,Duration,Spell Description,Name,English
Action,Self (100-foot line),V,S,M,A Handful of Iron,Instantaneous,"· You conjure a line of gravitational energy 100 feet long and 5
feet wide centered on yourself. All creatures on the line
must make a Constitution saving throw, taking 8d8 force damage on a failed save, or half as much damage on a successful one. ·
All creatures within 10 feet of the line but
not in the middle of it must make a Constitution saving throw, taking 8d8 force damage on a failed save and being pulled into the
area of the line. · Higher-level spellcasting effect. When you cast this spell using a spell slot of 7th level or higher, the spell's damage increases by 1d8 for each 
,Iron Wall,6,Protection,x,10 Minutes,Reach,V,S,M,Burning incense, a pinch of sulfur and oil, a knotted rope, a pinch of earth troll blood,
and a small silver rod worth at least 10 gp,24 hours,"· You create a protective area covering up to 2,500 square feet of floor space
(one 50-foot square, or one hundred 5-foot squares, or twenty-five 10-foot squares). The area can be up to 20 feet high and can be
shaped as you wish. You can divide the area to protect several floors of a fortress, as long as you can walk into each contiguous area
when you cast the spell. · When you cast
this spell, you can specify specific individuals to be immune to some or all of the spell's effects. You can also specify a password
that, when spoken aloud, makes the person who utters the password immune to those
effects. ·Iron Wall creates the following effects within
the protected area. ·Corridors: Thick fog fills the protected corridors, making them heavily obscured. In addition, creatures other
than you who encounter a fork in the corridor that requires them to choose a direction have a 50%
chance of mistaking the wrong direction for the correct direction. ·Door: All doors in the protected area are magically locked, equivalent
to the arcane lock spell. In addition, you can cover up to 10 doors with an illusion (equivalent to the illusory object effect of the
lesser illusion spell) to make them look like flat walls. ·Stairs: Spider webs cover the stairs in the protected area from top to bottom,
equivalent to the effect of the spider web spell. While the iron wall spell persists, even
if these spider webs are burned or torn, they can be regenerated after 10 minutes. ·Other spell effects:
You can place one of the following magic effects of your choice in the protected area of the fortress. √ Place Dancing in four corridors
Lights. You can arrange a
simple dance of lights that repeats itself as long as
the Guards and Walls spell persists. √ Place Magic Mouth at two locations. √ Place Stinking Cloud at two locations. Its clouds
appear where you choose. While the Guards and Walls spell persists,
even if the clouds are blown away by the wind, they regenerate after 10 minutes. √ Place a
persistent Gust of Wind at a corridor or room. √ Place a Suggestion at a location. You designate a square up to 5 feet in size, and any
creature that enters or passes through it is
mentally suggested by the spell. · The entire protected area radiates magic. When Dispel Magic is cast on a specific effect, it removes
that specific
effect if the spell succeeds. · When you cast this spell daily at the same location for a year, you create a permanent Guards and
Walls effect. ",Guards and Walls,Guards and Walls
Wards,√,,,,,,√,,,Player's Handbook,Miserable Wounds,6,Dead Soul,x,1 Action,60 ft.,V,S,×,×,Instant,· You unleash a deadly disease
on a creature you can see within range. The target must make a Constitution saving throw, or take 14d6 necrotic damage on a failed
save, or half as much damage on a successful one. This damage can't reduce the target's hit points below 1. If the target fails its
Constitution saving throw, its hit point maximum is reduced by an amount equal to the necrotic damage taken. The reduction lasts
for 1 hour, and any effect that removes disease can restore the target's hit
point maximum to normal before the time limit expires. ,Harm,,√,,,,,,,,,Player's Handbook,Heal,6,Evocation,x,1 Action,60
ft.,V,S,×,×,Instant,"·Specify a creature you can see within range. A surge of positive energy fills the creature, healing it to 70 hit points.
This spell also ends blindness, deafness, and any disease effects
currently affecting the target. This spell has no effect on constructs and undead creatures. ·Upgraded spellcasting effect. When
casting this spell using a spell slot of 7th level or higher, the amount healed
increases by 10 points for each level higher than the 6th level you use.",Heal,,√,√,,,,,,,Player's Handbook,Heroes' Feast,6,Conjuration,x,10
Minutes,30 ft.,V,S,M,"A spell worth at least 1,000 gp. jeweled bowl as a consumable for the spell",Instantly,"· You create a feast of
the finest food and drink. The feast takes 1 hour to consume, and disappears at the end of that time, and the following benefits don't
take effect until
after that hour. You can have up to twelve creatures join you to share in the feast. · All creatures that partake of the feast gain
several benefits. They are cured of all disease and poison conditions, are immune to poison and the panic condition, have advantage
on Wisdom saving throws, increase their maximum hit points by 2d10, and gain an equal number of hit points.
These benefits last for 24 hours. ",Hero's Feast,,√,√,,,,,,,,Player's Handbook,Empowered by Flame,6,Variations,x,1
Action,Self,V,S,×,×,"Concentration,Up to 10 minutes","· Flames surround your body, illuminating an area 30 feet in radius and 30
feet outside. A faint glow appears within a 1-foot radius. These flames do not harm you. Until this spell ends, you gain the following benefits:

· You are immune to fire damage and resistant to
cold damage. · Any creature that enters within 5 feet of you for the first time during a turn, or ends its turn within 5 feet of you,
takes 1d10 points of
fire damage. · You can use your action to create a line of fire 15 feet long and 5 feet wide, starting at you and extending in a
direction of your choice. Each creature in the line must make a Dexterity saving throw. A creature that fails its saving throw
takes 4d8 points of fire damage, or half as much damage on a successful one. ",Investiture of Flame,,,√,,,√,√,√,,,,Player's
Handbook,Empowerment of Ice,6,Variations,x,1 Action,Self,V,S,×,×,"Concentration,Up to 10 minutes","· Until this spell ends,
ice bathes your body, giving you the
following benefits: · You are immune to cold damage
and resistant to fire damage. · You can move over difficult terrain made of ice or snow
without expending extra movement points. · A 10-foot-radius area around you is frozen, treating it as difficult terrain for all but
you. This radius moves as
you move. · You can use your action to create a 15-foot cone of cold wind, starting at your open hand and extending in any
direction of your choice. Each creature in the cone must make a Constitution saving throw. On a failed save, it takes 4d6 points
of cold damage, or half as much damage on a successful one. A creature that fails its saving throw against this effect has its
speed halved until the start of your next turn. ",Empowerment of Ice,,,√,,,√,√,√,,,,Player's
Handbook,Empowerment of Stone,6,Variations,x,1 Action,Self,V,S,×,×,"Concentration,Up to 10 minutes","· Until the spell ends,
rock particles cover your body, and you
gain the following benefits: · You gain resistance to bludgeoning, piercing,
and slashing damage from nonmagical attacks. · As an action, you can create a small earthquake in the ground in a 15-foot
radius around you. Other creatures on the ground must
succeed on a Dexterity saving throw or fall prone. · You can move over difficult terrain created by dirt or stone without
expending additional movement. You can move through solid dirt or stone as if you were moving through air. This does not
make the material you pass through less solid, but you cannot end your movement in the material. If you end your movement,
you are expelled to the nearest unoccupied space, the spell ends, and you are stunned until the end of your next turn.
",Empowerment of Stone,,,√,,,√,√,√,,,,Player's Handbook,Empowerment of Wind,6,Variations,x,1
Action,Self,V,S,×,×,"Concentration,Up
to 10 minutes","· Until this spell ends, the wind swirls around you, and
you gain the following benefits: · Ranged weapon attacks against you have disadvantage on attack rolls. You gain a fly speed
of 60 feet.
If you are still flying when this spell ends, you fall unless you have another way to avoid falling. You can use your action to
create a 15-foot cube of whistling wind centered on a point you can see within 60 feet of you. Each creature in that space must
make a Constitution saving throw. A creature takes 2d10 points of bludgeoning damage on a failed save, or half as much
damage on a successful one. If a creature of Large size or smaller fails this saving throw, the creature is pushed 10 feet
away from the center of the space. ",Empowerment of Wind,,√,,√,√,√,,,Player's Handbook,Magic Pot,6,Dead Souls,x,1
min,Self,V,S,M,A gem or crystal, or a reliquary, or other decorated container of at least 500 gp value, until removed,"· Your soul
leaves your body and enters the container that is the material component of the spell, while your body becomes trance-like.
While your soul is in the container, you are aware of your surroundings as if you were in the container's location. You cannot
move or use reactions, and your only actions are to project your soul up to 100 feet out of the container, return to your
still-living body (ending the spell), or attempt to possess the body of another humanoid. · You can possess any humanoid
you can see within 100 feet of you (creatures protected by Protection from Evil and Good or Magic Circle cannot be possessed).
The target must make a Charisma saving throw. If you fail the save, your soul enters the target's body and the target's soul is
trapped in the container. If you succeed, the target resists your
possession, and you cannot attempt to possess the creature again for 24 hours. · Upon successful possession, the target's
body is controlled by you. Your game data is replaced with the creature's attribute data, but you retain your alignment and
Intelligence, Wisdom, and Charisma attribute values. Your class feature benefits are also maintained while possessed, but you cannot use any class features 
Additionally, the possessed creature's soul can use its own senses to see from inside the container, but it can neither move nor
use
actions. While possessing a body, if the container is within 100 feet of you, you can use an action to return from the host's body to
the container and return the host's soul to its own body. If the host's body dies while you are in the host's body, you must make a
Charisma saving throw against the spell's save DC. On a successful save and the container is within 100 feet of you, you return
to the container. On a failed save,
you die. If the container is destroyed or the spell ends, your soul immediately returns to your own body. If your body is more than
100 feet away or your body dies when you try to return to your own body, you die. If the soul of another creature was in the container
when the container is destroyed, and that creature's body is still alive and within 100 feet of it, its soul returns to its body.
Otherwise, that creature dies. When the spell ends, its container is destroyed. ",Magic Jar,Magic Jar,,,,,,,√,,,,Player's
Handbook,Mass Suggestion,6,Enchantment,x,1 Action,60 ft.,V,×,M,A snake's tongue plus a small piece of honeycomb or a drop
of olive oil,24 hours,"·You magically affect up to twelve creatures you can see within range, suggesting an action (in the form of up
to one or two sentences). The target you designate must be able to hear and understand your words. Creatures that cannot be
charmed are immune to this effect. Your suggestion must make the action sound reasonable. Asking a creature to stab itself,
throw itself on the spear, sacrifice itself, or do anything obviously harmful will immediately cancel the effect of
the spell. ·Each target must make a Wisdom saving throw. If the save fails, it will do the action you describe to the best of its ability.
The action you suggest may continue for the duration of the spell. If the activity you suggest can be completed in a shorter time, the
spell ends as soon as the target completes your
request. · You can also describe a specific condition that occurs during the duration as a condition for triggering a special action.
For example, you could suggest that a group of soldiers give all their money to the first beggar they encounter. If the condition is
never met before the
spell ends, the specified action is not performed. · If you or anyone in your party harms a creature affected by this spell, the effect
of this
spell on that creature ends. · Upgraded spellcasting effect. When you cast this spell using a 7th-level spell slot, the duration becomes
10 days. When you cast this spell using an 8th-level spell slot, the duration becomes 30 days. When you cast this spell using a
9th-level spell slot, the duration becomes one year and one day. ",
Mass Suggestion, √,,,,,√,√,√,,,, Player's Handbook, Mind Prison, 6, Illusion, x, 1 Action, 60 feet, ×, S, ×, ×,"Concentration, up to 1
minute", "· You attempt to confine the target creature to an illusory prison that only it can perceive. A visible creature of your
choice within range must make an Intelligence saving throw. If the target is immune to charms, it automatically succeeds on this
saving throw. On a successful save, the target takes 5d10 psychic damage and the spell ends. On a failed save, you immediately
create some kind of dangerous zone around the target's space, dealing 5d10 psychic damage. You might
make the target feel like it's surrounded by fire, floating blades, or terrifying fangs. Whatever form your illusion takes, the target
can't see or hear anything beyond it and is restrained for the duration of the spell. If the target moves outside the illusion, makes a
melee attack roll through it, or attempts to move through it with any part of its body, the target takes 10d10 psychic damage and the
spell ends. ",Mental Prison,,,,,√,√,√,,,Player's Handbook,Earth Movement,6,Transformation,x,1 Action,120 ft.,V,S,M,An iron blade
and a small bag filled with a mixture of clay, loam, sand, or other dirt,"Concentration,Up to 2 hours","·Specify a square of terrain within
range that is no longer than 40 feet on a side, and reshape the dirt, sand, or clay in the area in any way you like. You can raise
or lower the ground in the area, make or fill a ditch, raise or level a hill, or shape a pillar. The maximum length of the terrain being
altered cannot exceed half the longest side of the entire area. Thus, if you affect a 40-foot square, you can create a pillar up to 20
feet high, raise or lower the ground up to 20 feet, dig a trench up to 20 feet deep, and so on. These changes take 10 minutes to
complete. ·For every 10 minutes of concentration you maintain for the spell, you can choose a new
area of terrain to affect. ·Because changes to the terrain occur so slowly, creatures in the area are usually not
trapped or injured by the movement of the ground. ·This spell cannot change natural rock or stone buildings. However, the stone
and buildings will still be changed to adapt to the changes in the terrain.
If you change the terrain in a way that makes the building unstable, it may collapse. ·In addition, this spell cannot directly affect
plant growth. Instead, the removed soil will take away any plants growing on it. ",Earth Movement,Move Earth,,,√,,,√,,√,,,,Player's Handbook

,Otiluk Frozen Sphere,6,Evocation,x,1 Action,300 ft.,V,S,M,A Small Crystal Sphere,Instant,"· A ball of frozen energy shoots from
your fingertips to a designated point within range, where it bursts into a 60-foot-radius sphere. Each creature in the area must make
a Constitution saving throw. A creature takes 10d6 points of cold damage on a failed save. Half as much damage on a
successful save. · If the ball of ice strikes a body of water or a liquid surface that is primarily water (not including creatures
composed of water), the surface of the water it touches freezes in a 6-inch-thick, 30-foot-wide square. Any creature swimming
within is trapped by the ice. A trapped creature can use an action to make a Strength
check against the spell save DC to break free. · You can delay firing the ice after completing this spell. A small ball of ice the size
of a projectile will form on your hand, and it will feel cold to the touch. You or any creature that has taken the ice ball from your hand
can throw it at any time (with a range of 40 feet) or sling it (with a sling's normal range), and break it with an impact to produce the
same effect as when casting the spell normally. You can also set the ice ball without breaking it.
The ball will automatically burst after it lasts for 1 minute without breaking. · Upgraded spellcasting effect. When casting this spell
using a spell slot of 7th level or higher, the damage increases by 1d6 for each level higher than the 6th level of the
slot you use. ",Otiluke's Freezing Sphere,,,,,,,,√,,,,Player's Handbook,Otiluke's Bewitching Dance,6,Enchantment,x,1 Action,30
feet,V,×,×,×,"Concentration,Up to 1 Minutes","·Specify a creature you can see within range, and cause the target creature to do
a funny dance on the spot: it will shuffle,
stamp, and jump for the duration. Creatures that cannot be charmed are immune to the spell. ·The dancing creature must use
all of its movement to dance on the spot, and it has disadvantage on Dexterity saving throws and attack rolls. While the target is
affected by this spell, other creatures have advantage on attack rolls against it. The dancing creature can use an action to make
a Wisdom saving
throw, which ends the spell if it succeeds. ",Otto's Irresistible Dance,√,,,,,,, √,,,,Player's Handbook,Oath of the
Otherworld,6,Conjuration,x,10 minutes,60√,V,S,×,×,Instant,"· You invoke the aid of an outsider. This being must be known to
you; it may be a deity, a primordial, a demon lord, or some other planar power. The being sends a celestial, elemental, or fiend in
its service to you, and causes that creature to manifest in an unoccupied space within range. If you know the name of a specific
creature, you can name it when you cast the spell, but you may get a different creature instead (the DM's
choice).· When the creature appears, you cannot force it to do anything. You can request its services in exchange for a reward,
but it is under no obligation to perform them. The task requested can be simple (help us fly across a ravine, or assist in a battle)
or complex (spy on our enemies, or protect us as we raid a dungeon). You must be able to communicate with the creature to
bargain for its
services.· The reward may come in a variety of forms. A celestial creature might demand a sizable donation of gold or magic
items to an allied temple, while a fiend might demand a sacrifice or a gift of treasure. Some creatures may ask you to perform a
task in exchange for their services.
As a rough guide, a task that can be performed by the minute requires a payment of 100 gp per minute. A task that can be
performed by the hour requires a payment of 1,000 gp per hour. A task that can be performed by the day (up to 10 days) requires
a payment of 10,000 gp per day. The DM can adjust the specific payment based on the circumstances in which you cast this
spell. If the task is consistent with the creature's code of conduct, the payment may be halved or even abandoned. Risk-free tasks
generally require only half the suggested payment,
while particularly dangerous tasks may require a larger gift. Creatures rarely accept tasks that seem suicidal. After the creature
completes the task, or when the agreed-upon service period is up, if the task is appropriate and possible, the creature returns to
its home plane before reporting back to you. If you cannot agree to the price of the creature's services, it returns to its home
plane immediately. ·Creatures
called to join your party count as party members and share experience gained normally.",Planar Ally,, √,,,,,,,,,,Player's
Handbook,Primal Guardian,6,Protection,x,1
Action,Self,V,S,×,×,"Concentration,Up to 1 minute","·You are resistant to acid, cold, fire, lightning, and thunder damage for the
duration of this spell. ·When you take damage of one of these types, you can use your reaction to gain immunity to that type of
damage, including the damage that triggered this effect. If you do, the resistance effect ends and you
have the corresponding immunity until the end of your next turn, after which the spell ends. ",Primordial
Ward,,,√,,,,,,,,Player's Handbook,Preset Illusion,6,Illusion,x,1 Action,120 ft.,V,S,M,A bit of wool and emerald dust worth at least 25 gp,Until dispelled,"· You 
Fiendish Spirit Large Fiend
Activated under specific circumstances. The illusion is invisible until it is activated. It must be no larger than a 30-foot cube, and
you decide how the illusion should act and what sounds it should make when you cast the spell. This scripted
performance can last up to 5 minutes. · When the circumstances you specify occur, the illusion quickly takes shape and
performs as you choose. After the performance, the illusion
vanishes and remains dormant for 10 minutes. After this time, the illusion can be activated again. · The circumstances that
trigger the illusion can be general or as specific as you like, but they must be something that can be seen or heard within 30 feet
of the target area. For example, you could create an illusion of yourself that appears and warns others when they try to open a
trapped door, or you could create an illusion that triggers when a creature utters the correct word or phrase. · Because illusions
cannot be touched, any physical interaction with the illusion reveals its illusionary nature. When a creature uses its action to
investigate an illusion, it can make an Intelligence (Investigation) check against the spell save DC to determine whether it sees
through the illusion. A creature
that discerns the illusion sees through the image, and the sounds it produces appear false to the creature. ",Programmed Illusion,
√,,,,,,√,,,Player's Handbook,Scatter,6,Conjuration,x,1 Action,30 ft.,V,×,×,×,Instantly,·You choose up to 5 visible creatures within
range, and the air vibrates around them. An unwilling creature must succeed on a Wisdom saving throw to resist the spell. You
teleport each affected creature to any unoccupied space
you can see within 120 feet. The space must be on the ground or on the floor.,Scatter,,,,,√,√,√,,,Player's Handbook,Soul
Cage,6,Undead,x,1 Reaction when you see a humanoid die within 60 feet,60 ft.,V,S,M,A silver cage worth at least 100 gp,8
hours,"·This spell seizes the soul of a dead humanoid and imprisons it in the cage you use as the spell's material component.
The stolen soul remains in the cage until the spell ends or you destroy the cage, which also ends the spell. While you have a
soul in the cage, you can use it in any of the ways described below. You can use a trapped soul up to six times in this way.
Once you use the soul a sixth time, it is released and the
spell ends. While the soul is trapped, the dead humanoid creature it originated from cannot be resurrected.
Steal Life: You can use a bonus action to drain vitality from a soul and regain 2d8 hit points. Query Soul: You ask the soul a
question (no action required) and receive a brief answer as telepathic communication in any language you can understand.
The soul knows only what it knew in life, but it must answer truthfully and
to the best of its ability. The answer is no more than a sentence or two, and may have hidden meanings. Borrow Experience:
You can use a bonus action to let the soul's life experience bolster you, giving you advantage on your next attack roll, ability
check, or saving
throw. If you do not use this buff before the start of your next turn, it disappears. Eyes of the Dead: You can use an action to
name a location this humanoid has seen in life, and if you are on the same plane as that location, you can create an invisible
sensor there. This sensor lasts until your concentration ends, up to 10 minutes (as if you were concentrating on a spell). You
receive visual and auditory information from this
sensor as if you were using your own senses at that location. Creatures that can see this sensor (such as by using the See
Invisibility spell or having true seeing) see a translucent image of the victim you have caged. ",Soul Cage,,,,,,√,√,,,Player's
Handbook,Fiendish Summoning/Summon Fiendish Spirit,6,Conjuration,x,1 Action,90 ft.,V,S,M,A ruby vial of humanoid blood
