#REF!,Spell Name,Level,School,Ritual,Casting Time,Range,V Verbal,S Posture,M Materials,Material Content,Duration,Spell Description,Name,English
Handbook,Mind Spike,2,Divination,x,1 Action,60 ft.,×,S,×,×,"Concentration,Up to 1 hour","· You touch the mind of a creature you
can see within range. The target must make a Wisdom saving throw, taking 3d8 psychic damage on a failed save, or half as
much on a successful one. If the target fails its saving throw, you gain knowledge of the target's location until the spell ends,
as long as you are on the same plane. While you have this information, the target can no longer hide from you, and if it is
invisible, it does not benefit from that condition against you. · Upgraded spellcasting effects. When you cast this spell using a
spell slot of 3rd level or higher, increase the damage by 1d8 for each higher level slot used.
",Mind Spike,,,,,,√,√,√,,,,Sanatha's Guide to Everything,Mirror Image,2,Illusion,x,1 Action,Self,V,S,×,×,1 Minute,"· Three illusory
copies of yourself appear at your location. Until the spell ends, the copies move with you and mimic your movements and
changes of position, making it impossible to track which one is your real
self. While the copies exist, you can use your action to dismiss the illusory copies. · For the duration of the spell, each time a
creature
targets you with an attack, roll a d20 to determine whether the attack hits one of the copies. If you have three copies, you
must roll a 6 or higher for the target's attack to hit one. If you have two copies, you must roll an 8 or higher. If
you have one copy, you must roll an 11 or higher. The copies' AC is equal to 10 + your Dexterity modifier. When a single attack
hits a copy, that copy is immediately destroyed. A copy is destroyed by only one attack that hits it, ignoring all
other damage and effects. The spell ends when all three copies are destroyed. This spell has no effect on a creature that
cannot see, that can rely on a sense other than sight (such as blindsight), or that can see illusions as if they were real. ",Mirror
Image,,,,,√,√,√,,,Player's Handbook,Misty Step,2,Conjuration,x,1 Bonus Action,Self,V,×,×,×,Instantly,· You are briefly enveloped
in a silvery mist, teleporting to an unoccupied location you can see up to 30 feet away.,Misty Step,,,,,√,√,√,,,Player's
Handbook,Moonlight,2,Evocation,x,1 Action,120 feet,V,S,M,A few moonvine seeds and a milky long stone,"Concentration, up to
1 minute","· A 5-foot-radius, 40-foot-tall, column-shaped area centered on a point within range is bathed in a faint silvery light.
The column remains filled with dim light until the spell ends. ·
Creatures that enter the area for the first time in a turn or start their turn in the area are engulfed in ghostly flames and suffer
intense burning pain. The creature must make a Constitution saving throw, taking 2d10 points of radiant damage on a failed
save,
or half as much damage on a successful one. · A polymorphed creature has disadvantage on this saving throw, and if it fails it
immediately reverts to its original form, and
cannot change into another form until it leaves the light of the spell. · You can use an action on each of your turns
after casting this spell to move the radiance up to 60 feet in any direction. · Upgraded spellcasting effect. When casting this
spell using a spell slot of 3rd level or higher, increase the damage by 1d10 for
each level higher than 2nd level you use the slot. ",Moonbeam,,,√,,,,,,,,,Player's Handbook,Nestu Magical Aura,2,Illusion,x,1
Action,Reach,V,S,M,A small square of silk,24 hours,"· You place an illusion on a creature or object you touch, causing
divination spells to reveal false information about the target. The target
can be a willing creature or an object that is not being worn or carried by another creature. When you cast this spell, you
choose one or two of the following effects. The effect lasts for the duration. If you cast this spell on the same creature or
object every day for 30 days and choose the same effect each time, the illusion persists until it is dispelled. False Aura: Detect
aura spells and magical effects (such as the spell detect magic) display different information about the target. You can make a
nonmagical object appear magical, a magical object appear nonmagical, or change an object's magical aura to appear to be of
a specific school of magic of your choice. When you cast this effect on an object, you cause this false magic to appear to any creature using the item.

Mask: Spells and magical effects that detect a creature's type (such as a paladin's divine sense or the triggering condition of a symbol spell)
now display different information. You choose a creature type, and other spells and magical effects will interpret the target creature as that
type or as belonging to that type's alignment. ",Nystul's Magic Aura,Nystul's Magic Aura,,,,,,,,√,,,,Player's Handbook,Move without
Trace,2,Abjuration,x,1 Action,Self,V,S,M,A sprig of burnt mistletoe and a sprig of spruce,"Concentration,Up to 1 hour",·A veil of shadow and
silence radiates from you, blocking any detection of you and your companions. You designate several creatures (including yourself) within 30
feet of you. For the duration of the spell, the target creature gains a +10 bonus on Dexterity (Stealth) checks and cannot be tracked except by
magical means. A creature with this bonus leaves no footprints or other traces as it passes through a place., Pass without Trace,,,√,,√,,,,,Player's
Handbook,Phantom Power,2,Illusion,x,1 Action,60 feet,V,S,M,A bit of
wool,"Concentration,Up to 1 hour",·A veil of shadow and silence radiates from you, blocking any detection of you and your companions. You
designate several creatures (including yourself) within 30 feet of you. For the duration of the spell, the target creature gains a +10 bonus
on Dexterity (Stealth) checks and cannot be tracked except by magical means. A creature with this bonus leaves no footprints or other
traces as it passes through a place., Pass without Trace,,,√,,√,,,,,Player's Handbook,Phantom
Power,2,Illusion,x,1 Action,60 feet,V,S,M,A bit of wool,"Concentration,Up to 1 hour
Minutes","·You designate a creature you can see within range and create an illusion rooted in its consciousness. The target must make an
Intelligence saving throw. On a failed save, you create an illusory
object, creature, or other visible phenomenon of your choice, no larger than a 10-foot cube that can be perceived only by the target. This
creation persists until the spell ends. The spell has no effect on undead creatures and constructs. ·The illusion includes sound, temperature,
and other responsive factors, and is also only visible to the target. ·The target can use its action to make an Intelligence (Investigation) check
against the spell's save DC to examine the illusion. On a successful check,
the target realizes that the illusion is an illusion, and the spell ends. ·The target under the spell's influence assumes the illusion is real and
will rationalize any illogical interactions with the illusion. For example, a subject trying to walk across an illusory bridge across a ravine falls
off the bridge as soon as it takes its first step. If the target survives the fall, it still believes the bridge was real and may offer some alternative
explanation for its fall—perhaps a shove, a slip, or perhaps a strong wind blew it off. The target is convinced of the illusion's reality
and is even harmed by it. An illusion
that takes the form of a creature can attack the target. For example, an illusion that takes the form of fire, acid, or lava can burn the target. On
each of your turns, the illusion can deal 1d6 points of psychic damage to the target while it is in the illusion's damage area or within 5 feet of the
creature
it manifests. The target then feels the damage as if it were the type of creature the illusion manifested. ",Phantasmal Force,Phantasmal
Force, √,,,,√,,√,,,Player's Handbook,Prayer of Healing,2,Evocation,x,10 minutes,30 feet,V,×,×,×,Instant,"·
You choose up to six creatures you can see within range, and heal each of them to a point equal to 2d8 hit points + your key attribute
modifier. This spell has no effect on undead creatures or constructs. ·Upgraded spellcasting effect. When you cast this spell using a spell
slot
of 3rd level or higher, the amount healed increases by 1d8 for each level higher than 2nd. ",Prayer of Healing,,√,,,,,,,,,Player's
Handbook,Protection against poison,2,Protection,x,1 Action,Touch,V,S,×,×,1 hour,"· You
touch a creature. If poisoned, neutralizes the poison. If the target has more than one poison, choose one you know or one at random to
neutralize. · For the duration of the spell, the target has advantage on saving throws against poison and
resistance to poison damage. ",Protection from Poison,,√,√,√,√,,,√,,,Player's Handbook,Fireworks,2,Variations,x,1 Action,60
ft.,V,S,×,×,Instant,"·Choose a nonmagical fire that fills a 5-foot cube that you can see within range. You
can extinguish the fire in the area, or you can create fireworks or smoke. ·Fireworks: The target explodes with dazzling colored light. Creatures
within 10 feet of the target must succeed on a Constitution saving throw or be blinded until the end of your next turn. ·Smoke: The target
emits thick black smoke that
spreads in a 20-foot radius, skirting corners. The area of the smoke is heavily obscured. The smoke lasts for 1 minute or until dispersed by
strong winds.",Fireworks,Pyrotechnics,√,,,,√,,√, √,,,Xanatha's Guide to Everything,Ray of Enfeeblement,2,Necromancer,x,1 Action,60
ft.,V,S,×,×,"Concentration,Up to 1 minute","· You fire a ray of debilitating black energy from your
fingertips at a creature within range. You make a ranged spell attack against the target. On a hit, the target deals only half damage with
Strength-based attacks until the spell ends. · The target can make a Constitution saving throw against this spell at the end of each of its turns. The spell ends on a successful 
,Rope,2,Variations,x,1 Action,Reach,V,S,M,Cornmeal and a roll of parchment,1 hour,"· You touch a length of rope no longer than 60
feet. One end of the rope rises upward until the entire length hangs perpendicular to the ground. At the top of the rope is an invisible
portal to an alternate dimension that persists for the duration of the spell. · The alternate
dimension is accessible from the top of the rope and can hold up to eight Medium or smaller creatures. The rope can be pulled
back into the space, at which point it can no longer be seen from outside the
dimension. · Attacks and spells cannot enter or exit the alternate dimension through the portal, but creatures inside can see
through the portal as if there were a 3-foot-by-5-foot window at the
rope's location. · When the spell ends, everything in the alternate dimension falls out.",Rope, Trick,,,,,,,,√,√,,,Player's
Handbook,Scorching Ray,2,Evocation,x,1 Action,120 ft.,V,S,×,×,Instant,"· You create three rays of fire and then send them at a
target within range. You can aim all of them at the same target or at different targets. Each ray requires a separate ranged spell
attack. If it hits, the target takes 2d6 points of fire damage. · Upgraded spellcasting
effect. When you cast this spell using a spell slot of 3rd level or higher, you can create one additional ray for each level higher than
2nd.",Scorching Ray,,,,,√,,√,,,,Player's Handbook,See Invisibility,2,Divination,x,1
Action,Self,V,S,M,Pinch of talcum powder and a pinch of silver powder,1 hour,· You can see invisible creatures and objects as if
they were visible for the duration of the spell. You can also see into the Ethereal Plane, where creatures and objects appear to you
as ghostly, translucent objects. ,See Invisibility,√,,,,√,,√, √,,,Player's Handbook,Shadow Blade,2,Illusion,x,1 Bonus
Action,Self,V,S,×,×,"Concentration,Up to 1 minute","· You weave shadows into a materialized sword in your hand. This magical sword
lasts until the spell ends. It is treated as a simple melee weapon with which you are proficient, dealing 2d8 psychic damage on a
hit, and has the dexterity, lightness, and throwing qualities (range 20/60). When you use this sword to attack a target in dim light or
darkness, you have advantage on
attack rolls. · If you drop or throw the weapon, it dissipates at the end of your turn. Thereafter, as long as the spell lasts, you can
make the sword reappear in
your hand as a bonus action. · Upgraded spellcasting effect. When you cast this spell at 3rd-4th level, its damage increases to
3d8. At 5th-6th levels, it increases to 4d8. 7 ",Shadow Blade,,,,,√,√,√,,,,Shanasa's Guide to Everything,Sonic
Shattering,2,Evocation,x,1 Action,60 feet,V,S,M,A Piece of Mica,Instantaneous,"· You designate a point within range at which a
deafening noise suddenly erupts. All creatures in a 10-foot-radius sphere centered on that point must make a Constitution saving
throw. A creature that fails the saving throw takes 3d8 points of thunder damage; a successful one reduces the damage by half.
Creatures made of inorganic matter (such as stone,
crystal, or metal) have disadvantage on this saving throw. · If there is a nonmagical object within the range of the
spell that is not worn or carried by any creature, it also takes the damage. · Upgraded spellcasting effect. When casting this spell
using a spell slot of 3rd level or higher, the number of points of thunder damage
increases by 2 for every 2 points of thunder damage used. For each ring higher, the spell damage increases by 1d8.
",Shatter,√,,,,√,√,√,,,Player's Handbook,Silence,2,Illusion,√,1 Action,120 feet,V,S,×,×,"Concentration,Up to 10 minutes",·You designate
a point within the casting range. A 20-foot-radius sphere centered on that point will not produce any sound for the duration of the
spell, and no sound from the outside can enter the area. Any creature or object completely within the area is immune to thunder
damage, and any
creature completely within the area is deafened. In addition, no spells with verbal components can be cast within the area.,Silence,√,√,,
√,,,,,,Player's Handbook,Write in the Air,2,Variation,√,1 Action,In Vision,V,S,×,×,"Concentration,Up to 1 hour",·You cause up to 10
words to appear in a portion of the sky you can see. The words appear to be made of clouds, and remain in place for the duration
of the spell. The words
disappear when the spell ends. Strong winds can disperse the clouds, causing the spell to end prematurely.,Skywrite,√,,√,,,,√,
√,,,Shanatha's Guide to Everything,Snilo Snowball Swarm,2,Evocation,x,1 Action,90 ft.,V,S,M,A block of ice or a small shard of white
rock,Instantly,"·At a point you designate within range, a stream of magical snowballs erupts. All creatures in a 5-foot-radius
sphere centered on that point must make a Dexterity saving throw. On a failed save, they take 3d6 points of cold damage. On a successful save, they take half 
Bestial Spirit
· Higher-level spellcasting effect. When you cast this spell using a spell slot of 3rd level or higher, the damage increases by 1d6
for each higher level slot used. ",Snilloc's Snowball Swarm,Snilloc's Snowball Swarm,,,,,,√,,√,,,,Sannasa's Guide to
Everything,Spider Climb,2,Variations,x,1 Action,Reach,V,S,M,A drop of pitch and a spider,"Concentration,Up to 10 minutes",·
You touch a willing creature, causing it to move up or down a vertical surface or sideways, or even hang from a ceiling upside
down without using its hands, before the spell ends. In addition, the target gains a climb speed equal to its walking speed.,Spider
Climb,,,,, √,√,√,√,,,,Player's
Handbook,Thorn Grove,2,Variations,x,1 Action,Reach,V,S,M,Seven thorns or twigs, each sharpened,"Concentration,Up to 10
minutes","· The ground 20 feet around a point within range warps and deforms, and large, tough thorns break through the ground.
The area is treated as difficult terrain for the duration of the spell. Creatures that enter or move through it take 2d4 points of
piercing
damage for every 5 feet they move. · The deformation of the ground caused by the spell is deliberately disguised so that it does
not appear unusual. If a creature cannot see the area when you cast this spell, it must make a Wisdom (Perception) check to
detect the hidden danger in the area. ",Spike
Growth,,,√,,√,,,,,,Player's Handbook,Spiritual Weapon,2,Evocation,x,1 Bonus Action,60 ft.,V,S,×,×,1 Minute,"· You create an
ethereal weapon at a point within range that lasts until the spell's duration ends or you cast the spell again. When you cast this
spell, you can make a melee spell attack against a creature within 5 feet of the weapon. If you hit, the target takes 1d8 points of
force damage + your
spellcasting key attribute modifier. · As a bonus action on your turn, you can move the weapon up to 20 feet and make another
identical attack against a
creature within 5 feet of it. · The weapon's appearance is yours. If the cleric casting the spell is a deity associated with a specific
weapon (such as St. Cuthbert's mace, Thor's hammer), the spell creates a weapon similar in
appearance to that weapon. · Higher-level spellcasting effect. When you cast this spell using a spell slot of 3rd level or higher,
the spell's damage increases by 1d8 for every two levels above 2nd that the slot you use is
higher. ",Spiritual Weapon,,√,,,,,,,,,Player's Handbook,Suggestion,2,Enchantment,x,1 Action,30 ft.,V,×,M,A snake's tongue, plus a
small piece of honeycomb or a drop of sweet oil,"Concentration,Up to 8 hours","· You magically affect a creature you can see
within range, suggesting an action (in the form of up to a sentence or two). The target of your choice must be able to hear and
understand your words. Creatures that cannot be charmed are immune to this effect. Your suggestion must make the action
sound reasonable. Asking the creature to stab itself, throw itself onto the spear, sacrifice itself, or
do anything obviously harmful cancels the spell's effect. · The target must make a Wisdom saving throw or it will do the action
you describe to the best of its ability. The action you suggest may continue for the duration of the spell. If the action you suggest
can be completed in less time, the spell ends
once the target has completed your request. You can also describe a specific condition that occurs within the duration as a
condition for a specific action. For example, you could suggest that a group of soldiers give all their money to the first beggar
they encounter. If the
condition is not met before the spell ends, the action is not performed. The spell ends if you or any of your companions harm the
target.
",Suggestion,√,,,,√,√, √,,,,Player's Handbook,Beast Summoning/Summon Beast Spirit,2,Conjuration,x,1 Action,90 ft.,V,S,M,A
feather worth at least 200 gp, a bundle of fur, and a fish tail in a gilded acorn, "Concentration, up to 1 hour", "· You call upon the
spirit of a wild beast. This spirit materializes in an unoccupied space visible to you within range. This entity uses the statistics for
Aberrant Spirit, below. When you cast this spell, choose an environment from Air, Land, or Water. This creature takes the form of
an animal from your chosen environment, and some of its data sheet traits are affected by this. When its hit points drop to 0 or
the spell ends, the creature disappears. · The creature is friendly to you and your companions for the duration of the spell. In
combat, the creature uses your initiative but acts immediately after your turn ends. It obeys your verbal commands (no actions
are required).
If you give no commands, it takes the Dodge action and moves away from danger. · Higher-level spellcasting effects. When this spell is cast using a spell 
Hit Points: 20 (air only) or 30 (land and sea only) +5 for each spell level 2 levels higher than
the target Speed: 30 ft., climb 30 ft. (land only), fly 60 ft. (air only), swim 30 ft. (sea only) Str 18 (+4) Dex 11 (+0) Con
16 (+3) Int 4 (-4) Wis 14 (+2) Cha 5 (-3) Senses: Darkvision
60 ft., passive Perception 12 Languages: Understand
your language Challenge Rating: — Proficiency
Bonus: Yours Flyby (air
only). The beast
does not provoke attacks
of opportunity from a foe when it flies out of its reach. Pack Tactics (land and sea only). The beast has advantage
on attack rolls against a target creature while at least one of its non-incapacitated allies is within 5 feet of the target. Water Breath
(sea only). The beast can use the air and water
breathing action Multiattack. The beast makes a number of attacks equal to half the
spell's
level (round down). Bite Maul. Melee Weapon Attack: Hit + your spell attack modifier, reach 5 ft., one target.
Damage: 1d8 + 4 + the spell's level of piercing damage. ",Summon Beast/Summon Beast Spirit,Summon Beast,,√,√,,,,,,,Tasha's
Universal Crucible,Tasha's Mind Whip,2,Enchant,x,1 Action,90 ft.,V,×,×,×,1 Round,"· You make a psychic strike at a
creature within range. The target must make an Intelligence saving throw. On a failed save, the target takes 3d6 points of psychic
damage and can't take a reaction until the end of its next turn. In addition, on its next turn, it must choose to move, take an action,
or take a bonus action; it can only do one of the three during this turn. On a successful save, the target takes half as much
damage and is not affected by the spell's other effects. · Upgraded caster effect. When you cast this spell using a spell
slot of 3rd level or higher, you can affect one additional target for each slot level higher than 2nd. Targets cannot be more than
30 feet apart. ",Tasha's Mind Whip,,,,,, √,,√,,,,Tasha's Universal Crucible,Chains of Protection,2,Abjuration,x,1
Action,Reach,V,S,M,One pair of
platinum rings worth at least 50 gp, worn by you and the target for the duration of the spell,1 hour,"· You touch a willing creature and
allow the magic of this spell to protect it. This spell creates a mystical link between you and the target that lasts until the spell ends.
The target gains a +1 bonus to AC and saving throws while within 60 feet of you, and gains resistance to all damage. In addition,
whenever the target takes damage, you take the same amount of damage. · This spell ends if you are reduced to 0 hit points
or if
you are more than 60 feet away from the target. If this spell is cast again on either linked creature, the original spell ends
immediately. You can also dispel this spell as an action.",Warding Bond,,√,,,,,,,,,,Player's Handbook,Warding Wind,2,Evocation,x,1
Action,Self,V,×,×,×,"Concentration,Up to 10 minutes","· A
strong gust of wind (20 feet per hour) swirls around you in a 10-foot radius and moves with you, always centered on you. This
wind lasts for the duration of the spell. · This wind has the following effects: It deafens you and other creatures in the area. It
extinguishes unprotected
flames in the area that are no larger than a
torch. It isolates poisonous gases, gases, and fogs that can be
dispersed by strong winds. The area is difficult terrain for creatures
other than you. If a ranged weapon attack enters
or leaves the wind zone, the attack roll gains disadvantage. ",Warding Wind,√,,√,,,
√,,√,,,,Sanatha's Guide to
Everything,Web,2,Conjuration,x,1 Action,60 ft.,V,S,M,A Small Web,,"Concentration,Up to 1 hour","· You designate a point within
range and summon a large mass of thick web. The web covers a 20-foot cube centered at that point and persists for the duration
of the spell. The web turns the area into difficult terrain and provides slight obscuration.
AC: 11 + spell level (natural armor)
Small beast

If the web is not anchored between two solid objects (such as a wall or tree) or straddles a floor, wall, or ceiling, the web you
summon collapses automatically, causing the spell to end at the start of your next turn. The web is 5 feet deep when
spread out on a flat surface. Any creature that starts its turn in a web or enters one during its turn must make a Dexterity
saving throw. On a failed save, it is restrained in the
web until it leaves the web or breaks free. A creature restrained by a web can use an action to try to break free. The creature
must make a Strength check against the spell save DC to be freed on a successful check. The webs are flammable. Each
5-foot cube of web that comes into contact with an open flame burns in 1 round. Any creature that starts its turn in the
burning area
takes 2d4 points of fire damage as a result. ",Web,,,,,√,,√, √,,,Player's Handbook,Magic Bag,2,Conjuration,√,1
Action,Self,×,S,×,×,"Concentration,Up to 1 hour","· You flick your wrist, causing an object in your hand to vanish. This object,
which only you can hold and
weighs no more than five pounds, is teleported to an extradimensional space, where it remains for the duration of the spell.
· Until the spell ends, you can use your action to summon the object to your free hand, or you can use an action to return the
object to the extradimensional space. Any object that is still in the
extradimensional space when the spell ends appears at your location, at your feet. ",Wristpocket,Wristpocket,,,,,,,,,,√,√,Scary
