#REF!,Spell Name,Level,School,Ritual,Casting Time,Range,V Verbal,S Posture,M Materials,Material Content,Duration,Spell Description,Name,English
Action,120 ft.,V,S,M,A black marble,Instant,"·A 20-foot-radius sphere of destructive energy forms at a point you can see within range
and begins to pull in creatures within it. All creatures within the sphere must make a Constitution saving throw. On a failed save, the
creature takes 5d10 points of force damage and is pulled in a straight line toward the center of the energy, stopping in an unoccupied
space as close to the center as possible (even if that means sending it flying into the air). If the save is successful, it takes half damage
and is not pulled away. · Upgraded
spellcasting effect. When you cast this spell using a spell slot of 5th level or higher, the spell's damage increases by 1d10 for each
slot level above 4th. ",Gravity Sinkhole,Gravity Sinkhole,,,,,,,,,,,√,Scary Island Explorer's Guide,Greater Invisibility,4,Illusion,x,1
Action,Reach,V,S,×,×,"Concentration,Up to 1 minute",·You or a creature you touch becomes invisible until the spell ends. Any clothing
or belongings held on the target also remain invisible.,Greater Invisibility,√,,,,√,,√,,,,Player's Handbook,Guardian of the
Faith,4,Conjuration,x,1 Action,30 ft.,V,×,×,×,8 hours,"·A large, ghostly
guardian appears in an unoccupied space you designate and can be seen within range, and hovers there for the duration of the spell.
The guardian occupying the space is a blur except for a gleaming sword and a shield emblazoned with the symbol of your patronus.
·Any creature hostile to you that comes within 10 feet of the guardian for the first time in a round must
make a Dexterity saving throw. A creature takes 20 points of radiant damage on a failed save, or half as much damage on a successful
one. After dealing a total of 60 points of damage, the guardian disappears. ",Guardian of Faith,,√,,,,,,,,,,Player's Handbook,Nature's
Guardian,4,Transformation,x,1 Bonus Action,Self,V,×,×,×,"Concentration,Up
to 1 minute","·The spirits of nature answer your call and transform you into a powerful guardian. The transformation lasts until the spell
ends. You choose one of the following forms to assume: Primal Beast or War Tree. ·Primal Beast: A beastly hide covers your body,
your
facial features become feral, and you gain the following benefits: Your walking speed increases by 10 feet. You gain darkvision out to
120 feet.
You have advantage on Strengthbased
attack rolls. Your melee
weapon attacks deal an extra 1d6 force
damage on hit.

Each must make a Dexterity saving throw, taking 2d8 bludgeoning damage and 4d6 cold damage on a failed save, or half as much
damage
on a successful one. · Hail turns the area affected by the storm into difficult terrain
until the end of your next turn. · Upgraded spellcasting effect. When casting this spell using a spell slot of 5th level or higher,
increase the bludgeoning damage by 1d8 for each level higher than 4th level you use.
",Ice Storm,,,√,,,√,,√,,,Player's Handbook,Leomon's Secret Chest,4,Conjuration,x,1 Action,Reach,V,S,M,"A 3-foot-by-2-foot-by-2-foot
fine chest made of rare materials worth at least 5,000 gp; and a miniature of the same chest worth at least 50 gp made of the same
materials",Instantly,"· You hide a chest and its contents on the Ethereal Plane. You must touch both the chest and the miniature as
a material component of the spell. The box can hold up to 12 cubic
feet of inanimate matter (3 feet by 2 feet by 2 feet). While the box is on the Ethereal Plane, you can use an action to touch its
model to recall it. The box appears on the ground in an unoccupied space within 5 feet of you. You can then use an action to touch
both
the box and the copy to return the box to the Ethereal Plane. After 60 days, the spell's effects have a cumulative 5% chance of
ending automatically each day. The spell's effects end if you cast the spell again, if the box's model is destroyed, or if you end
the spell as an action. If the spell ends while the box is on the Ethereal Plane, it is irretrievably lost. ",Leomund's Secret
Chest,,,,,,,,√,√,,,Player's Handbook,Locate Creature,4,Divination,x,1 Action,Self,V,S,M,A bloodhound hide,"Concentration,Up to 1
hour","· You name or describe a creature you are familiar with. As long as the creature is within 1,000 feet of you, you gain a sense
of its location. If the creature is moving, you also know the
direction it is moving. · This spell can locate a specific creature you know; or it can locate the nearest member of a specific
class of creatures (such as humans or unicorns), provided you have seen that class of creature at least once within 30 feet. If the
creature named or described is not in its normal form (such as while under the effect of a Polymorph spell), the spell cannot locate
it. · If a body of
running water at least 10 feet wide stands between you and the creature being located, blocking the path between the two, the
creature cannot be located by this spell.",Locate Creature,Locate Creature,√,√,√,√,√,,,√,,,,Player's
Handbook,Mordunkainen's Faithful Dog,4,Conjuration,x,1 Action,30 Feet,V,S,M,A Tiny Silver Whistle, a Bone, and a String,8 Hours,"·
You create a phantom guardian dog in an unoccupied space you can see within range. The guardian dog remains in place for the
duration of the spell, until you use an action to dismiss it or until you move 100 feet away from it. · All creatures
except you treat the guardian dog as invisible and cannot harm it. When a Small or larger creature comes within 30 feet of the
guardian dog, the guardian dog begins barking loudly unless the creature speaks the command you gave when you cast the spell.
Guardian Hounds can see invisible creatures, see into the Ethereal Plane, and ignore
illusions. · At the start of each of your turns, the guardian hound attempts to bite a hostile creature within 5 feet of it. Its attack
bonus is equal to your spellcasting ability modifier + your proficiency bonus. If it hits, it deals 4d8 points of piercing
damage. ",Mordenkaine's Faithful Hound,,,,,,,,√,√,,,,Player's Handbook,Mordenkaine's
Private Sanctum,4,Protection,x,10 minutes,120 feet,V,S,M,A thin sheet of lead, a piece of opaque glass, a small piece of cotton or
cloth, and chrysolite powder,24 hours,"· You magically protect an area within range. The area is a cube with a side as small as 5 feet
and as large as 100 feet. This spell lasts until the duration ends or the caster takes an action to remove it. When you cast
this spell, you decide what protections are in effect. Choose from the following properties, some or all of which you can choose: √
Sound
cannot penetrate the barrier at the edge of the
protected area √ The barrier around the protected area becomes dark and indistinct, and cannot be
seen by vision (including darkvision). √ Sensors created by divination spells cannot appear within the protected
area, nor can they pass through the barrier at the edge
of the area. √ Creatures within the area cannot be
targeted by divination spells. √ Nothing can be
teleported into or out of the protected area. √ Planar travel is blocked within the protected area. · Casting this spell daily at the same location for one year makes 
· Upgraded spellcasting effect. When you cast this spell using a spell slot of 5th level or higher, you increase the size of the protected
cube by 100 feet for each level higher than the 4th level slot you use. For example, using a 5th-level slot, you can protect a cube up
to 200 feet on a side.",Mordenkaine's Private Sanctum,,,,,,,,√,√,,,Player's Handbook,Otiluk's Elastic Sphere,4,Evocation,x,1
Action,30 Feet,V,S,M,A hemispherical piece of clear crystal and a matching hemispherical piece of gum arabic,"Concentration, Up to 1
Minute","· A faintly glowing sphere of force encloses a Large or smaller creature or object within range. An unwilling creature must
make a Dexterity saving throw or be trapped within the sphere for the duration of the spell. ·Nothing—physical objects, energy, or
other spell effects—
can penetrate the barrier of the force field sphere to enter or exit it, but creatures can still breathe normally inside the sphere. The
sphere is immune to all damage, and creatures or objects inside the sphere cannot be harmed by attacks or effects from outside the
sphere, and creatures inside the sphere cannot cause damage to
objects outside the sphere. ·The sphere is weightless and its size is just right to contain the creatures or objects inside the sphere.
The trapped creatures can use their actions to push the walls of the sphere and roll the sphere at half the
creature's speed. In addition, the sphere can be picked up or moved by other creatures. ·Casting
Disintegrate on the sphere can destroy the sphere without harming anything inside the sphere. ·Additional note: The designer
explained that [Teleport] effects such as Anywhere Door and Thunder Step can enter and
exit the force field wall. ",Otiluke's Resilient Sphere,Otiluke's Resilient Sphere,,,,,,,,√,√,,,Player's Handbook,Phantom Killer,4,Illusion,x,1
Action,120 ft.,V,S,×,×,"Concentration,Up to 1 min.","· You designate a creature you can see within range and peer into its nightmares
to materialize its deepest fears, creating an illusory embodiment that only the target can see. The target creature must make a Wisdom
saving throw. On a failed save, the target is panicked for the spell's duration. At the end of each of its turns before the spell ends, the
target must make a Wisdom saving throw or take 4d10 points of psychic damage on a failed save. On a successful save, the spell
ends. ·Upgraded-level spellcasting effect. When casting this spell using a spell slot of 5th level or
higher, increase the damage by 1d10 for each level higher than 4th. ",Phantasmal Killer,,,,,,,,√,,,,Player's Handbook,Polymorph,4,Change,x,1
Action,60 ft.,V,S,M,One caterpillar cocoon,"Concentration,Up to 1 hour","·This spell changes a creature you can see within range
into a new form. An unwilling creature must make a Wisdom saving throw
to avoid this effect. This spell has no effect on a polymorphed creature or one with 0 hit points. ·The changes caused by the spell last
for the duration of the spell or until the target's hit points drop to 0 or die. The new form can be any beast with a challenge rating less
than or equal to the target's own (or its challenge rating if the target has no challenge rating). The target's game data and mental
attributes are replaced by those of the chosen beast. Its alignment and personality are retained. ·The target uses the hit points of its
new form. When it changes back to its normal form, it immediately regains its pre-transformation hit points. If the target reverts to its
normal form because it is reduced to 0 hit points, its normal form takes all the
extra damage. As long as the extra damage does not reduce the creature's normal form to 0 hit points, it does not fall unconscious
from the blow. · The
creature's actions are limited by its new form. It cannot speak, cast spells, or perform other actions that require the use of its hands
or speech. · The target's equipment merges with its new form,
but it cannot activate, use, wield, or otherwise benefit from its equipment. ",Polymorph,√,,√,,,√,,√,,,,Player's Handbook,Shadow of
Moi,4,Dead,x,1 Action,Self,V,S,M,An undead eye set in a gemstone worth at least 150 gp, "Concentrate, up to 1 minute", "· A flame-like
shadow
completely envelops your body, heavily obscuring you from others until the spell ends. · The shadow turns dim lighting within 10 feet
of you to darkness, or turns bright lighting in the same area to dim light. Until the spell ends, you gain resistance to radiant damage. In
addition, whenever a creature within 10 feet of you hits you with an attack, the shadow slams that creature, dealing 2d8 points of
necrotic
damage to it. ",Shadow of Moil,,,,,,,√,,,,,Sanatha's Guide to Everything,Pathogenic Radiation,4,Evocation,x,1 Action,120
ft.,V,S,×,×,"Concentration,Up to 10 minutes","·Pale green light spreads out into a 30-foot-radius sphere centered on a
point within a distance of your choice. The light extends around corners and persists until the spell ends. ·When a creature enters the
spell's area for the first time during a turn, or starts its turn in it, the creature must succeed on a Constitution saving throw or take 4d10 radiant damage and one 
Aberrant Spirit Aberrant Spirit Mediumsized
aberrant
HP: 40+10 per spell level above 4 Speed 30 ft.,
fly 30 ft. (beholder-like only, levitate) Str 16 (+3) Dex 10 (+0) Con
15 (+2) Int 16 (+3) Wis 10 (+0) Cha 6 (-2) Immunities: Psychic
Senses: Darkvision 60 ft., passive Perception 10 Languages:
Deepspeak, understands
you Challenge Rating: —
AC: 11 + spell level (natural armor)
The creature loses the benefits of invisibility. The light and any levels of exhaustion incurred by this spell disappear when the spell ends.
",Sickening Radiance,,,,,√,√,√,,,,Sannasa's Guide to Everything,Staggering Smite,4,Evocation,x,1
Bonus Action,Self,V,×,×,×,"Concentration,Up to 1 minute",·The next time you hit a creature with a melee weapon attack during the spell's duration,
your weapon pierces both its body and mind. This attack deals an extra 4d6 points of psychic damage to the target. The target must make a Wisdom
saving throw or it has disadvantage on attack rolls and ability checks, and can't perform reactions until the end of its next turn.,Staggering
Smite,,,,√,,,,,,,,Player's Handbook,Stoneshaping,4,Transformation,x,1 Action,Reach,V,S,M,Soft clay that must be molded into the approximate
shape you want to shape,Instantly,·You touch a Medium or smaller stone object or a rock that is no more than 5 feet tall, 5 feet wide, and 5 feet
high. 5 feet, and shape it into any shape you want. For example, you can turn a large stone into a weapon, a statue, or a coffin, or you can cut a
small passage in a stone wall, provided that the wall is no thicker than 5 feet. You can also deform a stone door or stone door frame to seal the
door. The object you create can have up to two hinges and a bolt, and other than that, you cannot use this spell to shape more complex
mechanical structures. ,Stone Shape,,√,√,,,,,√,√,,,,Player's Handbook,Stoneskin,4,Protection,x,1 Action,Reach,V,S,M,100gp worth of diamond
dust as a consumable for this spell,"Concentration,Up to 1 Hours",·
This spell causes the skin of a willing creature you touch to become as hard as rock. The target becomes resistant to nonmagical bludgeoning,
piercing, and slashing damage until the spell ends.,Stoneskin,,,√,,√,√,,√,√,,,Player's Handbook,Storm Ball,4,Evocation,x,1 Action,150
ft.,V,S,×,×,"Concentration,Up to 1 minute","· Within range, a 20-foot-radius sphere of strong wind appears centered
on a point you designate. The sphere persists for the duration of the spell. Creatures within the sphere when it appears, or whose turns end within
it, must succeed on a Strength saving throw or take 2d6 points of bludgeoning damage. The space within the sphere becomes difficult terrain. ·
Until the spell ends, you can use a bonus action on each of your turns to cause a bolt of lightning to burst from the center of the sphere, striking
creatures within 60 feet of the center. Make a ranged spell attack with
advantage if the target is inside the sphere. If it hits, the target takes 4d6 points of lightning damage. · Creatures within 30 feet of the sphere
have disadvantage on Wisdom (Perception) checks to listen. · Upgraded spellcasting effect. When you cast this spell using a spell slot of 5th level
or higher, increase the damage of all effects by 1d6 for each
level higher than 4th level. ",Storm Sphere,,,,,√,,√,,,,Shanatha's Guide to Everything,Summoning aberrations/
Summoning aberrations,4,Conjuration,x,1 Action,90 ft.,V,S,M,A pickled tentacle and an eyeball in a platinum jar worth at least 400 gp,
"Concentration, up to 1 hour", "· You summon a spirit from a far realm or another realm of madness. The spirit materializes in an unoccupied
location visible to you within range. This entity uses the statistics for Aberrant Spirit below. When you cast a spell, choose a beholderkin, slaadi,
or star spawn. The creature takes on the appearance of your choice, and some of the traits on its data sheet are affected by that choice. When its
hit points drop to 0 or the spell ends, the creature disappears. · The creature is friendly to you and your companions for the duration of the spell. In
combat, the creature uses your initiative but acts immediately after your turn ends. It obeys your verbal commands (no actions are required). If
you give no commands, it takes the evasive action and moves away from danger. · Higher-level spellcasting effects. When this spell is cast using
a spell slot of 5th level
or higher, the creature's statistics use the higher level of the spell.

Construct Spirit Medium construct
AC: 13 + spell
level (natural armor)
Proficiency Bonus:
Regeneration equal to yours (slaad only). At the start of the aberration's turn, it regains 5 hit points, provided it has at
least 1 hit
point. Whispering Aura (starchild only). At the start of each of the aberration's turns, each creature within 5 feet of it must
succeed on a Wisdom saving throw against your spell save DC or take 2d6 points of
psychic damage. Actions Multiattack. The aberration makes a number of attacks equal to half the
spell's level (rounded down). Claws (slaad only). Melee Weapon Attack: Hit + your spell attack modifier, reach 5 feet,
one target. Damage: 1d10 + 3 + the spell's level of slashing damage. If the target is a creature, it doesn't regain
hit points until the start of the aberration's next turn. Eye Ray (beholder only). Ranged Spell Attack: Hit + your spell attack
modifier, range 30 feet, one creature. Damage:
1d8+3+level psychic damage. Psychic Slam (Starchild only). Melee Spell Attack: Hit + your spell attack modifier, reach 5
ft., one creature. Damage: 1d6+3+level psychic damage. ",Summon Aberration,,,,,,,√,√,,,Tasha's
Cauldron,Construct Summon,4,Conjuration,x,1 Action,90
ft.,V,S,M,An ornate stone and a metal cryptex of at least 400 gp value, "Concentration, up to 1 hour", "· You call upon a
construct spirit. It materializes in an unoccupied space visible to you within range. This entity uses the Construct Spirit's
statistics below. When you cast the spell, choose a material from Clay, Metal, or Stone. This creature takes the form
of a golem or modron of your chosen material, with some of the traits listed on its data sheet affected by this. When its
hit points drop to 0 or the spell ends, the creature disappears. · The creature is friendly to you and your companions for
the
duration of the spell. In combat, the creature uses your initiative but acts immediately after your turn ends. It obeys
your verbal commands (no actions are required). If you give no commands, it takes the evasive action and moves away
from danger.
· Upgraded spellcasting effects. When this spell is cast using a spell slot of 4th level or higher, the creature's data uses the higher level of the spell.
HP: 40+15 per spell level higher than 3 levels (sic)
Speed: 30 ft.
Str 18 (+4) Dex 10 (+0) Con 18 (+4) Int 14 (+2) Wis 11
(+0) Cha 5 (-3) Damage Resistance: Poison Condition
Immunities: Charm,
Exhaustion, Panic, Incapacitated, Paralyzed, Petrified, Poisoned
Senses: Darkvision 60 ft., Perception 10
Languages: Understand
your language
Challenge Rating: —
Proficiency Bonus: Yours Heated Body (metal only). A creature that touches or hits with a melee attack while within 5 feet
of a construct takes 1d10 points of fire
damage. Stony Lethargy (stone only). When a creature that a construct can see starts its turn within 10 feet of it, the
construct can be forced to make a Wisdom saving throw against your spell save DC. On a failed save, it can't use a
reaction until the start of its
next
turn, and its speed is halved. Actions Multiattack. The construct makes a number of attacks equal to half
the spell's level (round down). Slam. Melee Weapon Attack: Hit + your spell attack modifier, reach 5 feet, one target.
Damage: 1d8 + 4 + spell level points of bludgeoning damage

Reaction Berserk Lashing (Clay only). Whenever a construct takes damage, it makes a slam attack against a random creature within 5
feet of it. If no creature is within reach, the construct moves at half its speed toward a foe it can see, without provoking attacks of
opportunity. ",Summon Construct,,,,,,,,√, √,,,Tasha's Cauldron,Summon Greater Demon,4,Conjuration,x,1 Action,60 ft.,V,S,M,A dose
of blood from a humanoid
slain within the past 24 hours, "Concentration, up to 1 hour", "· You utter obscenities, summoning a demon from the endless chaos of
the Abyss. You choose a demon of your choice with a CR of 5 or lower, such as a Shadow Demon or Barlgura. The demon appears in
an unoccupied space visible to you within range. When it reaches 0 hit points or the spell ends, it disappears. The demon takes its own
turn, and you roll initiative for it. When you summon it and each of your turns thereafter, you can give it verbal commands (without your
action)
telling it what it must do next turn. If you do not give it commands, it spends its turn attacking any creature within reach that attacks it.
At the end of each of the demon's turns, it makes a Charisma saving throw. If you say its true name, the demon has disadvantage on
this saving throw. If the saving throw fails, the demon continues to obey you. If
the saving throw succeeds, you lose control of the demon for the remainder of the spell, and the demon spends its turn chasing and
attacking the nearest nondemon creature, doing what it can. Even if you break concentration on the spell before the full duration is
reached, an out-of-control demon remains in place for 1d6 rounds as long as it has hit points left. As part of casting this spell, you can
draw a circle on the ground using blood as a material. The circle is large enough to encompass the space you are in. For the spell's
duration, summoned
demons can't pass through or harm the circle, nor can they target anyone within it. Spell materials used in this way are consumed at
the end of the spell. · Higher-level spellcasting effect. When you cast this spell using a spell slot of 5th level or higher, increase the
challenge rating of the demon you summon by +1 for each level higher than 4th level.
",Summon Greater Demon,Summon Greater Demon,,,,,,,√,√,,,,Sannasa's Guide to Everything,Acid Sphere,4,Evocation,x,1 Action,150
ft.,V,S,M,A drop of giant snail's bile,Instantly,"· A glowing 1-foot-diameter ball of acid flies toward a point within a range you specify and
explodes,
splashing acid in a 20-foot-radius sphere. Each creature in the area must make a Dexterity saving throw. If the save fails, the creature
takes 10d4 points of acid damage, and an additional 5d4 points of acid damage at the end of its next turn. On a successful save, the
creature takes only half as much damage as the initial damage and takes no damage at the end of its next turn. · Upgraded spellcasting
effect. When you cast this spell using a spell slot of 5th level or higher, increase the initial damage by 2d4 for each level higher than
the slot
used above 4th level. ",Vitriolic Sphere,,,,,,√,,,,,Xanatha's Guide to Everything,Wall of Fire,4,Evocation,x,1 Action,120 ft.,V,S,M,A small
piece of phosphorus,"Concentrate, up to 1 minute","· You create a wall of fire on a solid patch of ground within range.
You can choose to create a straight wall of fire no longer than 60 feet long, no higher than 20 feet high, and no thicker than 1 foot; or a
circular wall of fire no longer than 20 feet in diameter, no higher than 20 feet high, and no thicker than 1 foot. The wall of fire is
opaque and persists until the spell ends. · When the wall of fire appears, all creatures in the area of the wall must make a Dexterity
saving
throw. A creature takes 5d8 points of fire damage on a failed saving throw. Half as much damage on a successful saving throw. ·
When you cast this spell, you must
choose which side of the wall of fire will deal damage. A creature takes 5d8 points of fire damage when it is within 10 feet of the side of
the fire that is damaging or ends its turn in the area of the fire. The same damage is taken when a creature enters the wall of fire for
the first time in a turn or ends its turn inside the wall of fire. The other side of the
wall of fire deals no damage. · Upgraded spellcasting effect. When casting this spell using a spell slot of 5th level or higher, the spell's
damage increases by 1d8 for each level higher than 4th that the slot you use is. ",Wall of Fire,Wall
